{
  "$schema": "../schemas/crossref_matrix.schema.json",
  "generated_at": "2026-10-21T19:05:08+00:00",
  "description": "Source-derived file-to-file Markdown reference graph.",
  "format": "interned-v1",
  "layout": {"nodes": "[id, type]", "anchors": "distinct anchor strings", "edges": "[source_index, [[target_index, count, [anchor_index, ...]], ...]]"},
  "nodes": [
    ["core_00.000_preamble.md","core"],
    ["core_01.005_values_principles.md","core"],
    ["core_01.010_interaction_interpretation.md","core"],
    ["core_01.015_stewardship_capacity_principles.md","core"],
    ["core_02.000_definition_structure.md","core"],
    ["core_03.000_definition_integrity.md","core"],
    ["core_04.000_burden_traceability_verification.md","core"],
    ["core_05.000_definitions_home.md","core"],
    ["core_05.005_apex_accountability_leg.md","core"],
    ["core_05.010_apex_continuity_aim.md","core"],
    ["core_05.015_apex_flourishing_aim.md","core"],
    ["core_05.020_apex_oversight_leg.md","core"],
    ["core_05.025_apex_participation_leg.md","core"],
    ["core_05.030_apex_timeliness_leg.md","core"],
    ["core_05.035_band_accountability.md","core"],
    ["core_05.040_band_continuity.md","core"],
    ["core_05.045_band_integrative.md","core"],
    ["core_05.050_band_oversight.md","core"],
    ["core_05.055_band_participation.md","core"],
    ["core_05.060_band_performance.md","core"],
    ["core_07.000_charters.md","core"],
    ["core_08.000_functional_independence_segregation_of_duties.md","core"],
    ["core_09.005_system_alignment_certification_evaluation.md","core"],
    ["core_09.010_system_alignment_certification_record_process.md","core"],
    ["core_09.015_system_alignment_certification_illustrations.md","core"],
    ["core_09.020_institutional_alignment_certification.md","core"],
    ["core_09.000_system_alignment_certification.md","core"],
    ["core_10.000_standing_assessment.md","core"],
    ["core_11.000_standing_integration.md","core"],
    ["core_12.005_misconduct_designation.md","core"],
    ["core_12.010_misconduct_pattern_applications.md","core"],
    ["core_13.000_forum.md","core"],
    ["core_10.005_application_vignettes.md","core"],
    ["core_06.005_rights_part_a.md","core"],
    ["core_06.010_rights_part_b.md","core"],
    ["core_06.015_rights_part_c.md","core"],
    ["core_06.020_rights_part_d.md","core"],
    ["core_06.025_rights_part_e.md","core"],
    ["core_14.000_governance.md","core"],
    ["core_15.000_non_regression.md","core"],
    ["core_16.000_expansion_supremacy.md","core"],
    ["core_17.000_amendment_ratification.md","core"],
    ["core_18.000_incorporation.md","core"],
    ["corpus_systems.md","adopted-implementation"],
    ["corpus_institutions.md","adopted-implementation"],
    ["corpus_forum.md","adopted-implementation"],
    ["corpus_joint_structure.md","adopted-implementation"],
    ["corpus_joint_structure/cjs_00.105_registry_and_reading_rules.md","adopted-implementation"],
    ["corpus_joint_structure/cjs_00.110_scope_purpose_boundary_interface.md","adopted-implementation"],
    ["corpus_joint_structure/cjs_05.105_cross_implementation_operational_terms.md","adopted-implementation"],
    ["corpus_joint_structure/cjs_05.110_oversight_operations.md","adopted-implementation"],
    ["corpus_joint_structure/cjs_05.115_audit_process.md","adopted-implementation"],
    ["corpus_joint_structure/cjs_05.120_participation_operations.md","adopted-implementation"],
    ["corpus_joint_structure/cjs_05.125_accountability_operations.md","adopted-implementation"],
    ["corpus_joint_structure/cjs_05.130_continuity_operations.md","adopted-implementation"],
    ["corpus_joint_structure/cjs_05.135_integrative_operations.md","adopted-implementation"],
    ["corpus_joint_structure/cjs_05.140_odef_parse_mechanics.md","adopted-implementation"],
    ["corpus_joint_structure/cjs_08.105_support_hosting_classification.md","adopted-implementation"],
    ["corpus_joint_structure/cjs_18.105_drafting_contracts.md","adopted-implementation"],
    ["corpus_joint_structure/cjs_18.110_specific_joint_interlocks.md","adopted-implementation"],
    ["corpus_joint_structure/cjs_reader_guide.md","adopted-implementation"],
    ["corpus_systems/cs_00.305_registry_and_reading_rules.md","adopted-implementation"],
    ["corpus_systems/cs_00.310_scope_purpose_identifier_rules.md","adopted-implementation"],
    ["corpus_systems/cs_06.305_information_types_and_handling.md","adopted-implementation"],
    ["corpus_systems/cs_06.310_data_classifications.md","adopted-implementation"],
    ["corpus_systems/cs_06.315_comprehensibility_complexity_stewardship.md","adopted-implementation"],
    ["corpus_systems/cs_06.320_justice_safeguards_restitution_rehabilitation.md","adopted-implementation"],
    ["corpus_systems/cs_06.325_adaptive_sustainability_ecosystem_resilience.md","adopted-implementation"],
    ["corpus_systems/cs_06.330_decentralized_continuity_partition_resilience.md","adopted-implementation"],
    ["corpus_systems/cs_06.335_resource_allocation_funding_stewardship.md","adopted-implementation"],
    ["corpus_systems/cs_06.340_system_requirements.md","adopted-implementation"],
    ["corpus_systems/cs_06.345_design_testing_verification_deployment.md","adopted-implementation"],
    ["corpus_systems/cs_06.350_transition_constitution_migration_governance.md","adopted-implementation"],
    ["corpus_systems/cs_06.355_subversion_response_replacement_reconstitution.md","adopted-implementation"],
    ["corpus_systems/cs_09.305_system_classification_machinery.md","adopted-implementation"],
    ["corpus_systems/cs_09.310_system_impact_classifications.md","adopted-implementation"],
    ["corpus_systems/cs_14.305_critical_system_stewardship.md","adopted-implementation"],
    ["corpus_institutions/ci_00.205_registry_and_reading_rules.md","adopted-implementation"],
    ["corpus_institutions/ci_00.210_scope_purpose_legitimacy_interface.md","adopted-implementation"],
    ["corpus_institutions/ci_00.215_compliance_mapping_stable_registry.md","adopted-implementation"],
    ["corpus_institutions/ci_06.205_transparency_participation_accessible_pathways.md","adopted-implementation"],
    ["corpus_institutions/ci_06.210_public_revenue_fees_recurring_charges_billing_integrity.md","adopted-implementation"],
    ["corpus_institutions/ci_06.215_resource_stewardship_incentive_integrity.md","adopted-implementation"],
    ["corpus_institutions/ci_06.220_neurodiversity_disability_justice_trauma_informed_participation.md","adopted-implementation"],
    ["corpus_institutions/ci_06.225_care_labor_dependent_support_respite_care_economy_fairness.md","adopted-implementation"],
    ["corpus_institutions/ci_06.230_end_of_life_continuity_memorial_dignity_posthumous_data.md","adopted-implementation"],
    ["corpus_institutions/ci_06.235_collective_public_health_epidemic_response_addiction_informed_care.md","adopted-implementation"],
    ["corpus_institutions/ci_06.240_vulnerable_personal_services_markets_article_viie_interface.md","adopted-implementation"],
    ["corpus_institutions/ci_06.245_relational_coercive_control_intimate_power_anti_domination.md","adopted-implementation"],
    ["corpus_institutions/ci_06.250_community_life_voluntary_association_non_instrumental_time.md","adopted-implementation"],
    ["corpus_institutions/ci_06.255_commons_cooperatives_mutual_aid_non_market_governance.md","adopted-implementation"],
    ["corpus_institutions/ci_06.260_place_based_stewardship_indigenous_continuity_consultation.md","adopted-implementation"],
    ["corpus_institutions/ci_06.265_innovation_reward_disclosure_anti_enclosure.md","adopted-implementation"],
    ["corpus_institutions/ci_06.270_scientific_publication_peer_review_replication_evidence_stewardship.md","adopted-implementation"],
    ["corpus_institutions/ci_06.275_transitional_governance_institutional_evolution.md","adopted-implementation"],
    ["corpus_institutions/ci_08.205_institutional_design_separation_of_powers.md","adopted-implementation"],
    ["corpus_institutions/ci_08.210_conflict_integrity_anti_capture_anti_corruption.md","adopted-implementation"],
    ["corpus_institutions/ci_08.215_oversight_assurance_controls_evidence.md","adopted-implementation"],
    ["corpus_institutions/ci_09.210_classification_linked_institutional_obligations.md","adopted-implementation"],
    ["corpus_institutions/ci_11.205_remedy_systems_institutional_redress_capacity.md","adopted-implementation"],
    ["corpus_institutions/ci_11.210_institutional_failure_dissolution.md","adopted-implementation"],
    ["corpus_institutions/ci_11.215_institutional_accountability_sanctions.md","adopted-implementation"],
    ["corpus_institutions/ci_13.205_procedure_integrity_contestability_secondary_review.md","adopted-implementation"],
    ["corpus_institutions/ci_13.210_cross_institution_coordination_escalation.md","adopted-implementation"],
    ["corpus_institutions/ci_14.205_appointment_competency_rotation_removal.md","adopted-implementation"],
    ["corpus_forum/cf_00.405_registry_and_reading_rules.md","adopted-implementation"],
    ["corpus_forum/cf_00.410_scope_authority_boundary_rules.md","adopted-implementation"],
    ["corpus_forum/cf_13.405_forum_formation_chamber_structure.md","adopted-implementation"],
    ["corpus_forum/cf_13.410_panel_formation_disclosure_recusal_bench_constitution.md","adopted-implementation"],
    ["corpus_forum/cf_13.415_routing_operations_transfer_certification_representative_treatment.md","adopted-implementation"],
    ["corpus_forum/cf_13.420_appeal_secondary_review_exhaustion_pathways.md","adopted-implementation"],
    ["corpus_forum/cf_13.425_integrity_safeguards_anti_capture_anti_self_judging.md","adopted-implementation"],
    ["corpus_forum/cf_13.430_forum_forensic_analytical_support.md","adopted-implementation"],
    ["corpus_forum/cf_13.435_independent_investigative_service_prosecution_interface.md","adopted-implementation"],